{
  "$schema": "https://json-schema.org/draft/2020-12/schema",
  "title": "Sector Knowledge",
  "type": "object",
  "required": ["sector_name", "sector_slug", "hydrated_at", "model", "sub_sectors"],
  "properties": {
    "sector_name": { "type": "string", "minLength": 1 },
    "sector_slug": { "type": "string", "minLength": 1 },
    "hydrated_at": { "type": "string", "minLength": 1 },
    "model": { "type": "string", "minLength": 1 },
    "sub_sectors": {
      "type": "array",
      "minItems": 1,
      "items": { "$ref": "#/definitions/sub_sector_knowledge" }
    }
  },
  "definitions": {
    "evidence_item": {
      "type": "object",
      "required": ["claim", "source_title", "source_url"],
      "properties": {
        "claim": { "type": "string", "minLength": 1 },
        "source_title": { "type": "string", "minLength": 1 },
        "source_url": { "type": "string", "minLength": 1 },
        "confidence_note": { "type": "string" }
      }
    },
    "sub_sector_knowledge": {
      "type": "object",
      "required": [
        "sub_sector_name",
        "key_metrics",
        "valuation_approach",
        "regulatory_landscape",
        "historical_precedents",
        "moat_sources",
        "kill_factors",
        "fcf_margin_ranges",
        "typical_multiples"
      ],
      "properties": {
        "sub_sector_name": { "type": "string", "minLength": 1 },
        "key_metrics": {
          "type": "array", "minItems": 1,
          "items": { "$ref": "#/definitions/evidence_item" }
        },
        "valuation_approach": {
          "type": "array", "minItems": 1,
          "items": { "$ref": "#/definitions/evidence_item" }
        },
        "regulatory_landscape": {
          "type": "array", "minItems": 1,
          "items": { "$ref": "#/definitions/evidence_item" }
        },
        "historical_precedents": {
          "type": "array", "minItems": 1,
          "items": { "$ref": "#/definitions/evidence_item" }
        },
        "moat_sources": {
          "type": "array", "minItems": 1,
          "items": { "$ref": "#/definitions/evidence_item" }
        },
        "kill_factors": {
          "type": "array", "minItems": 1,
          "items": { "$ref": "#/definitions/evidence_item" }
        },
        "fcf_margin_ranges": {
          "type": "array", "minItems": 1,
          "items": { "$ref": "#/definitions/evidence_item" }
        },
        "typical_multiples": {
          "type": "array", "minItems": 1,
          "items": { "$ref": "#/definitions/evidence_item" }
        }
      }
    }
  }
}
