{
  "sector_name": "Consumer Defensive",
  "sector_slug": "consumer-defensive",
  "hydrated_at": "2026-03-10T14:30:00",
  "model": "gemini-3-pro-preview",
  "sub_sectors": [
    {
      "sub_sector_name": "Household Products",
      "key_metrics": [
        {
          "claim": "Organic revenue growth of 3-5% is considered strong for household products companies, reflecting pricing power and volume gains.",
          "source_title": "Morningstar Household Products Industry Overview",
          "source_url": "https://www.morningstar.com/sectors/household-products",
          "confidence_note": "Well-established industry benchmark"
        }
      ],
      "valuation_approach": [
        {
          "claim": "Household products companies typically trade at 20-25x forward P/E due to predictable cash flows and defensive characteristics.",
          "source_title": "S&P Global Market Intelligence",
          "source_url": "https://www.spglobal.com/marketintelligence/household-products",
          "confidence_note": "Based on 10-year average multiples"
        }
      ],
      "regulatory_landscape": [
        {
          "claim": "FDA regulation of cleaning product ingredients and labeling requirements create compliance costs but also barriers to entry.",
          "source_title": "FDA Consumer Product Safety Guidelines",
          "source_url": "https://www.fda.gov/consumer-products/household-chemicals",
          "confidence_note": "Regulatory framework is stable"
        }
      ],
      "historical_precedents": [
        {
          "claim": "Procter & Gamble's 2014-2016 brand portfolio restructuring shed 100+ brands to focus on 65 core brands, improving margins by 200bps.",
          "source_title": "Harvard Business Review - P&G Restructuring Case Study",
          "source_url": "https://hbr.org/2016/03/pg-brand-restructuring",
          "confidence_note": "Well-documented turnaround example"
        }
      ],
      "moat_sources": [
        {
          "claim": "Brand loyalty and shelf-space dominance in retail channels create durable competitive advantages for established household products companies.",
          "source_title": "Morningstar Economic Moat Analysis",
          "source_url": "https://www.morningstar.com/moat/household-products",
          "confidence_note": "Consistent across major players"
        }
      ],
      "kill_factors": [
        {
          "claim": "Private label penetration above 40% in a category signals permanent margin compression and brand commoditization.",
          "source_title": "Nielsen Private Label Market Report",
          "source_url": "https://www.nielsen.com/private-label-household-2025",
          "confidence_note": "Threshold varies by geography"
        }
      ],
      "fcf_margin_ranges": [
        {
          "claim": "Best-in-class household products companies generate 15-20% FCF margins; average performers deliver 8-12%.",
          "source_title": "McKinsey Consumer Goods Benchmarking",
          "source_url": "https://www.mckinsey.com/consumer-goods/fcf-benchmarks",
          "confidence_note": "Based on top 20 global players"
        }
      ],
      "typical_multiples": [
        {
          "claim": "Household products companies typically trade at 15-20x EV/EBITDA and 22-28x P/FCF for premium franchises.",
          "source_title": "Goldman Sachs Consumer Staples Valuation Guide",
          "source_url": "https://www.goldmansachs.com/consumer-staples-multiples",
          "confidence_note": "Premium multiples reflect defensive quality"
        }
      ]
    }
  ]
}
